{
  "contract_name": "investment-case-lineage-v1",
  "schema_version": "1.0.0",
  "lineage": {
    "lineage_id": "lineage-order-staged",
    "lineage_version": "1.0.0",
    "investment_case_id": "case-bhp-20260724",
    "lineage_stage": "ORDER_STAGED",
    "case_state": "ORDER_STAGED",
    "evidence_tier": "UNCALIBRATED",
    "as_of": "2026-07-24T04:00:00Z",
    "created_at": "2026-07-24T04:01:00Z",
    "research": {
      "thesis_id": 9001,
      "thesis_revision_id": 2001,
      "report_ref": {
        "id": "30000000-0000-4000-8000-000000000001",
        "sha256": "15e78231fdc3a814663bd44f453dd5f20de401e4fde11bf9501cf20ea420b3f7"
      },
      "report_candidate_sha256": "15e78231fdc3a814663bd44f453dd5f20de401e4fde11bf9501cf20ea420b3f7"
    },
    "review": {
      "context_id": "10000000-0000-4000-8000-000000000001",
      "context_sha256": "e541d5c07b6799b112ecbca786d0c64e51fc2e604def241bb0e4509d35d5a8aa",
      "review_cycle_id": "20000000-0000-4000-8000-000000000001",
      "eligibility_decision_id": "30000000-0000-4000-8000-000000000001",
      "eligibility_sha256": "e73426c8b3e60e85ef2513d1f7e2864fd8729abaf9f1dcc5e9fd45b78b6b99f3"
    },
    "monitor": {
      "watermark_id": "monitor-watermark-20260724",
      "watermark_as_of": "2026-07-24T03:00:00Z",
      "watermark_sha256": "eeeeeeeeeeeeeeeeeeeeeeeeeeeeeeeeeeeeeeeeeeeeeeeeeeeeeeeeeeeeeeee",
      "open_blocking_event_count": 0
    },
    "evaluation": {
      "evaluator_config_ref": {
        "id": "evaluator-config-main",
        "version": "1.0.0",
        "sha256": "ffffffffffffffffffffffffffffffffffffffffffffffffffffffffffffffff"
      },
      "evaluation_ref": {
        "id": "evaluation-main-20260724",
        "sha256": "1111111111111111111111111111111111111111111111111111111111111111"
      },
      "evaluation_policy_ref": {
        "id": "evaluation-policy-main",
        "version": "1.0.0",
        "sha256": "7e55ccba0a552ce89d2d03520775c73fc91b85a85d2d2b2e52c4557dac61b19c"
      },
      "gate_decision_ref": {
        "id": "gate-decision-20260724",
        "sha256": "3333333333333333333333333333333333333333333333333333333333333333"
      }
    },
    "construction_policy_ref": {
      "id": "construction-policy-main",
      "version": "1.0.0",
      "sha256": "fd23a97608fcc1e580c904f8d0a28c494f6dbd8d1cd28ea25f950ad0d887f975"
    },
    "risk_policy_ref": {
      "id": "risk-policy-main",
      "version": "1.0.0",
      "sha256": "99ccfe68e02b9f4f35880f88a3a1f5bce62ca96fc80b3991066f8f3822a1a33e"
    },
    "portfolio_proposal_ref": {
      "id": "portfolio-proposal-20260724",
      "sha256": "d096b62e8767f8ae5a345e537a2ec795e76379ffdfc6ab87ed87b4c24425057e"
    },
    "sizing_decision_ref": {
      "id": "sizing-decision-20260724",
      "sha256": "e19db22e142581fb1a745155e7691ac61ace2e0d8517a4f7ef2afdef5de3fdf4"
    },
    "staging_policy_ref": {
      "id": "staging-policy-main",
      "version": "1.0.0",
      "sha256": "27e58610f38c1dc66d00e505bc1dda0103bb3307273327cab3d22a24211616b6"
    },
    "promotion_decision_ref": {
      "id": "promotion-decision-20260724",
      "sha256": "7c1375065b30b8243c4f94acaf0f8e559ef7be2d8c5fb5cd8957931fe6444481"
    },
    "staged_order_set_ref": {
      "id": "staged-order-set-20260724",
      "sha256": "e45d628a500115eaaa910eaf3f5896d35c24dcfce6fcaac7e9c8c12aaec43a46"
    }
  },
  "canonical_hash": {
    "canonicalization": "RFC8785",
    "hash_algorithm": "SHA-256",
    "excluded_json_pointer": "/canonical_hash/payload_sha256",
    "payload_sha256": "1761fc4cc896486666284156afab409b92971e669c975a66dfa642b65c3c3fc9"
  }
}
