{
  "contract_name": "investment-case-lineage-v1",
  "schema_version": "1.0.0",
  "lineage": {
    "lineage_id": "lineage-evaluation-frozen",
    "lineage_version": "1.0.0",
    "investment_case_id": "case-bhp-20260724",
    "lineage_stage": "EVALUATION_FROZEN",
    "case_state": "SHADOW_ACTIVE",
    "evidence_tier": "UNCALIBRATED",
    "as_of": "2026-07-24T03:10:00Z",
    "created_at": "2026-07-24T03:11:00Z",
    "research": {
      "thesis_id": 9001,
      "thesis_revision_id": 2001,
      "report_ref": {
        "id": "30000000-0000-4000-8000-000000000001",
        "sha256": "15e78231fdc3a814663bd44f453dd5f20de401e4fde11bf9501cf20ea420b3f7"
      },
      "report_candidate_sha256": "15e78231fdc3a814663bd44f453dd5f20de401e4fde11bf9501cf20ea420b3f7"
    },
    "review": {
      "context_id": "10000000-0000-4000-8000-000000000001",
      "context_sha256": "e541d5c07b6799b112ecbca786d0c64e51fc2e604def241bb0e4509d35d5a8aa",
      "review_cycle_id": "20000000-0000-4000-8000-000000000001",
      "eligibility_decision_id": "30000000-0000-4000-8000-000000000001",
      "eligibility_sha256": "e73426c8b3e60e85ef2513d1f7e2864fd8729abaf9f1dcc5e9fd45b78b6b99f3"
    },
    "monitor": {
      "watermark_id": "monitor-watermark-20260724",
      "watermark_as_of": "2026-07-24T03:00:00Z",
      "watermark_sha256": "eeeeeeeeeeeeeeeeeeeeeeeeeeeeeeeeeeeeeeeeeeeeeeeeeeeeeeeeeeeeeeee",
      "open_blocking_event_count": 0
    },
    "evaluation": {
      "evaluator_config_ref": {
        "id": "evaluator-config-main",
        "version": "1.0.0",
        "sha256": "ffffffffffffffffffffffffffffffffffffffffffffffffffffffffffffffff"
      },
      "evaluation_ref": {
        "id": "evaluation-main-20260724",
        "sha256": "1111111111111111111111111111111111111111111111111111111111111111"
      },
      "evaluation_policy_ref": {
        "id": "evaluation-policy-main",
        "version": "1.0.0",
        "sha256": "7e55ccba0a552ce89d2d03520775c73fc91b85a85d2d2b2e52c4557dac61b19c"
      },
      "gate_decision_ref": {
        "id": "gate-decision-20260724",
        "sha256": "3333333333333333333333333333333333333333333333333333333333333333"
      }
    },
    "construction_policy_ref": null,
    "risk_policy_ref": null,
    "portfolio_proposal_ref": null,
    "sizing_decision_ref": null,
    "staging_policy_ref": null,
    "promotion_decision_ref": null,
    "staged_order_set_ref": null
  },
  "canonical_hash": {
    "canonicalization": "RFC8785",
    "hash_algorithm": "SHA-256",
    "excluded_json_pointer": "/canonical_hash/payload_sha256",
    "payload_sha256": "074f52d20f47daaa1322578dea74dbd5ff5935835959d834a14d5fc5a2099802"
  }
}
